{
 "schemaVersion": 2,
 "catalogVersion": 18,
 "version": 39,
 "generatedAt": "2026-10-05T07:48:49Z",
 "modules": [
  {
   "id": "games_hall",
   "name": "游戏大厅",
   "description": "内置入口，聚合宿主游戏与已下载的游戏模块。",
   "versionName": "1.0.0",
   "versionCode": 100,
   "entryClass": "com.gamecenter.app.features.BuiltInGamesHallModuleEntryPoint",
   "fileName": "",
   "fileSize": 0,
   "sha256": "",
   "downloadUrl": "",
   "fallbackUrl": "",
   "githubUrl": "",
   "iconUrl": "",
   "category": "game",
   "minAppVersion": 492,
   "minAppVersionCode": 492,
   "depends": [],
   "type": "nav",
   "activityClass": "",
   "gameId": "",
   "gameCategory": "",
   "gameDesc": "",
   "builtIn": true,
   "required": true,
   "storeCategory": "entertainment_versus",
   "isBaseFramework": true,
   "builtInVersionCode": 100,
   "runtimeType": "android",
   "deliveryType": "builtin",
   "minHostVersionCode": 492,
   "maxHostVersionCode": 0,
   "dependencies": []
  },
  {
   "id": "browser",
   "name": "浏览器",
   "description": "内置浏览器，支持网页浏览、历史记录、收藏夹、下载管理、追踪保护、阅读列表、离线缓存、页面翻译、骨架屏、Snackbar 反馈等 Batch 13-18 优化。",
   "versionName": "1.4.1",
   "versionCode": 587,
   "entryClass": "com.gamecenter.app.browser.ui.BrowserModuleEntryPoint",
   "fileName": "",
   "fileSize": 0,
   "sha256": "",
   "downloadUrl": "",
   "fallbackUrl": "",
   "githubUrl": "",
   "iconUrl": "",
   "category": "tool",
   "minAppVersion": 492,
   "minAppVersionCode": 492,
   "depends": [],
   "type": "nav",
   "activityClass": "",
   "gameId": "",
   "gameCategory": "",
   "gameDesc": "",
   "builtIn": true,
   "required": false,
   "storeCategory": "reading_browsing",
   "isBaseFramework": true,
   "builtInVersionCode": 587,
   "runtimeType": "android",
   "deliveryType": "builtin",
   "minHostVersionCode": 492,
   "maxHostVersionCode": 0,
   "dependencies": [],
   "details": {
    "valueDescription": "提供完整网页浏览体验，支持历史记录、收藏夹、下载管理、追踪保护与阅读列表。",
    "audience": "所有需要访问网页、查阅资料、阅读长文的用户。",
    "offlineCapability": "支持离线缓存页面与阅读列表，无网络时可查看已缓存内容；新页面加载需联网。",
    "updateImpact": "更新保留历史记录、收藏夹、下载文件与离线缓存，不影响用户数据。",
    "uninstallImpact": "卸载将清除浏览历史、缓存、Cookie 与离线阅读列表；下载的文件保留在下载目录。",
    "highlights": [
     "追踪保护与广告过滤",
     "阅读列表与离线缓存",
     "下载管理器",
     "页面翻译",
     "收藏夹同步"
    ],
    "limitations": [
     "部分视频网站可能因 DRM 限制无法播放",
     "翻译功能依赖在线服务"
    ]
   },
   "privacy": {
    "localData": "浏览历史、收藏夹、Cookie、离线缓存、下载记录",
    "cloudData": "无（不主动上传用户数据）",
    "networkDomains": [
     "用户主动访问的网站"
    ],
    "syncLocation": "无",
    "retentionPeriod": "直到卸载",
    "deletionMethod": "卸载即清除，或在设置内一键清除浏览数据"
   }
  },
  {
   "id": "tools",
   "name": "工具箱",
   "description": "实用工具模块，提供诊断、二维码、电池、设备与传感器辅助功能。",
   "versionName": "1.0.0",
   "versionCode": 100,
   "entryClass": "com.gamecenter.app.modules.ToolsModuleEntryPoint",
   "fileName": "feature_tools_v100.apk",
   "fileSize": 800780,
   "sha256": "7aeed01f18786db1992cccb9bb06ee2dde72f94c8b619cbd7e01fb24c8dd3e95",
   "downloadUrl": "https://hk-update.tcp888.uk:2083/modules/feature_tools_v100.apk",
   "fallbackUrl": "",
   "githubUrl": "",
   "iconUrl": "",
   "category": "tool",
   "minAppVersion": 492,
   "minAppVersionCode": 492,
   "depends": [],
   "type": "nav",
   "activityClass": "",
   "gameId": "",
   "gameCategory": "",
   "gameDesc": "",
   "builtIn": false,
   "required": false,
   "storeCategory": "device_network",
   "isBaseFramework": true,
   "builtInVersionCode": 0,
   "runtimeType": "android",
   "deliveryType": "apk",
   "minHostVersionCode": 492,
   "maxHostVersionCode": 0,
   "dependencies": [],
   "package": {
    "fileName": "feature_tools_v100.apk",
    "fileSize": 800780,
    "downloadUrl": "https://hk-update.tcp888.uk:2083/modules/feature_tools_v100.apk",
    "sha256": "7aeed01f18786db1992cccb9bb06ee2dde72f94c8b619cbd7e01fb24c8dd3e95"
   },
   "details": {
    "valueDescription": "提供设备诊断、二维码、电池信息、传感器测试等实用工具集合。",
    "audience": "需要查看设备信息、扫描二维码、测试硬件的用户。",
    "offlineCapability": "完全离线运行，无需任何网络连接。",
    "updateImpact": "更新不影响任何用户数据。",
    "uninstallImpact": "卸载将清除工具偏好设置；不影响其他模块。",
    "highlights": [
     "设备信息诊断",
     "二维码生成与扫描",
     "电池状态查看",
     "传感器测试",
     "完全离线"
    ],
    "limitations": [
     "部分传感器数据依赖设备硬件支持"
    ]
   },
   "privacy": {
    "localData": "工具偏好设置、二维码扫描历史（可选）",
    "cloudData": "无",
    "networkDomains": [],
    "syncLocation": "无",
    "retentionPeriod": "直到卸载",
    "deletionMethod": "卸载即清除"
   }
  },
  {
   "id": "ai",
   "name": "AI 助手",
   "description": "AI 聊天助手模块，支持对话历史与工具集成。",
   "versionName": "1.0.0",
   "versionCode": 100,
   "entryClass": "com.gamecenter.app.modules.AiModuleEntryPoint",
   "fileName": "feature_ai_v100.apk",
   "fileSize": 1205137,
   "sha256": "4b82eee9f2146ae4a87f91e2d1af247692706a5f75bc7d46f36cc867fd236347",
   "downloadUrl": "https://hk-update.tcp888.uk:2083/modules/feature_ai_v100.apk",
   "fallbackUrl": "",
   "githubUrl": "",
   "iconUrl": "",
   "category": "tool",
   "minAppVersion": 492,
   "minAppVersionCode": 492,
   "depends": [],
   "type": "nav",
   "activityClass": "",
   "gameId": "",
   "gameCategory": "",
   "gameDesc": "",
   "builtIn": false,
   "required": false,
   "storeCategory": "text_creation",
   "isBaseFramework": true,
   "builtInVersionCode": 0,
   "runtimeType": "android",
   "deliveryType": "apk",
   "minHostVersionCode": 492,
   "maxHostVersionCode": 0,
   "dependencies": [],
   "package": {
    "fileName": "feature_ai_v100.apk",
    "fileSize": 1205137,
    "downloadUrl": "https://hk-update.tcp888.uk:2083/modules/feature_ai_v100.apk",
    "sha256": "4b82eee9f2146ae4a87f91e2d1af247692706a5f75bc7d46f36cc867fd236347"
   },
   "details": {
    "valueDescription": "AI 对话助手，支持文本创作、问答、工具调用与上下文记忆。",
    "audience": "需要文本辅助、知识问答、内容创作的用户。",
    "offlineCapability": "需联网调用 AI 服务；本地仅保存对话历史，无网络时仅可查看历史。",
    "updateImpact": "更新保留对话历史与偏好设置。",
    "uninstallImpact": "卸载将清除所有对话历史与本地配置。",
    "highlights": [
     "多轮对话与上下文记忆",
     "文本创作与润色",
     "工具调用集成",
     "Markdown 渲染",
     "对话历史本地保存"
    ],
    "limitations": [
     "AI 响应质量依赖服务端模型",
     "长对话可能消耗较多流量"
    ]
   },
   "privacy": {
    "localData": "对话历史、偏好设置",
    "cloudData": "用户输入的对话内容与提示词",
    "networkDomains": [
     "AI 服务 API 域名"
    ],
    "syncLocation": "AI 服务商服务器",
    "retentionPeriod": "本地直到卸载；云端遵循服务商策略",
    "deletionMethod": "卸载即清除本地数据；云端数据需在服务商侧删除"
   }
  },
  {
   "id": "wrongbook",
   "name": "错题本",
   "description": "基于 AI 的错题整理与复习工具，支持拍照识题、AI 分析、艾宾浩斯复习计划。",
   "versionName": "1.0.0",
   "versionCode": 100,
   "entryClass": "com.gamecenter.app.wrongbook.WrongBookModuleEntryPoint",
   "fileName": "feature_wrongbook_v100.apk",
   "fileSize": 6269966,
   "sha256": "8a74a04fde0dceb50d0a4c9929c5440d1b3cc8923ca75ecc99671bb31ca163a4",
   "downloadUrl": "https://hk-update.tcp888.uk:2083/modules/feature_wrongbook_v100.apk",
   "fallbackUrl": "",
   "githubUrl": "",
   "iconUrl": "",
   "category": "tool",
   "minAppVersion": 492,
   "minAppVersionCode": 492,
   "depends": [],
   "type": "nav",
   "activityClass": "",
   "gameId": "",
   "gameCategory": "",
   "gameDesc": "",
   "builtIn": false,
   "required": false,
   "storeCategory": "learning_organization",
   "isBaseFramework": false,
   "builtInVersionCode": 0,
   "runtimeType": "android",
   "deliveryType": "apk",
   "minHostVersionCode": 492,
   "maxHostVersionCode": 0,
   "dependencies": [],
   "package": {
    "fileName": "feature_wrongbook_v100.apk",
    "fileSize": 6269966,
    "downloadUrl": "https://hk-update.tcp888.uk:2083/modules/feature_wrongbook_v100.apk",
    "sha256": "8a74a04fde0dceb50d0a4c9929c5440d1b3cc8923ca75ecc99671bb31ca163a4"
   },
   "details": {
    "valueDescription": "基于 AI 的错题整理与复习工具，支持拍照识题、AI 分析与艾宾浩斯复习计划。",
    "audience": "需要整理错题、规划复习的学生用户。",
    "offlineCapability": "复习计划与已识别错题离线可用；新错题的 AI 识别需联网。",
    "updateImpact": "更新保留所有错题数据与复习进度。",
    "uninstallImpact": "卸载将清除全部错题图片、笔记与复习计划，不可恢复。",
    "highlights": [
     "拍照识别错题",
     "AI 自动分析知识点",
     "艾宾浩斯复习计划",
     "复习提醒",
     "错题分类整理"
    ],
    "limitations": [
     "AI 识别准确率依赖服务端模型",
     "图片上传需消耗流量"
    ]
   },
   "privacy": {
    "localData": "错题图片、笔记、复习计划、知识点标签",
    "cloudData": "上传的错题图片（用于 OCR 与 AI 分析）",
    "networkDomains": [
     "OCR 服务",
     "AI 分析服务"
    ],
    "syncLocation": "OCR/AI 服务商服务器",
    "retentionPeriod": "本地直到卸载；云端遵循服务商策略",
    "deletionMethod": "卸载即清除本地数据；云端数据需在服务商侧删除"
   }
  },
  {
   "id": "vpn",
   "name": "VPN",
   "description": "仅远程使用的 VPN 模块，支持代理配置管理与连接控制。",
   "versionName": "1.0.0",
   "versionCode": 100,
   "entryClass": "com.gamecenter.app.vpn.VpnModuleEntryPoint",
   "fileName": "vpn-release.apk",
   "fileSize": 1134483,
   "sha256": "f255e9e371ec9338047c94838630928f3f20fd52fd3e87d8419c6e4f08298fb0",
   "downloadUrl": "https://hk-update.tcp888.uk:2083/modules/vpn-release.apk",
   "fallbackUrl": "",
   "githubUrl": "",
   "iconUrl": "",
   "category": "tool",
   "minAppVersion": 492,
   "minAppVersionCode": 492,
   "depends": [],
   "type": "nav",
   "activityClass": "",
   "gameId": "",
   "gameCategory": "",
   "gameDesc": "",
   "builtIn": false,
   "required": false,
   "storeCategory": "device_network",
   "isBaseFramework": false,
   "builtInVersionCode": 0,
   "runtimeType": "native_service",
   "deliveryType": "apk",
   "minHostVersionCode": 492,
   "maxHostVersionCode": 0,
   "dependencies": [],
   "serviceType": "vpn",
   "package": {
    "fileName": "vpn-release.apk",
    "fileSize": 1134483,
    "downloadUrl": "https://hk-update.tcp888.uk:2083/modules/vpn-release.apk",
    "sha256": "f255e9e371ec9338047c94838630928f3f20fd52fd3e87d8419c6e4f08298fb0"
   },
   "details": {
    "valueDescription": "提供远程代理连接能力，支持配置管理与连接状态控制。",